"cveID","vendorProject","product","vulnerabilityName","dateAdded","shortDescription","requiredAction","dueDate"
"CVE-2016-11021","D-Link","DCS-930L Devices","D-Link DCS-930L Devices OS Command Injection Vulnerability","2022-03-25","setSystemCommand on D-Link DCS-930L devices allows a remote attacker to execute code via an OS command.","The impacted product is end-of-life and should be disconnected if still in use.","2022-04-15"
"CVE-2016-10174","NETGEAR","WNR2000v5 Router","NETGEAR WNR2000v5 Router Buffer Overflow Vulnerability","2022-03-25","The NETGEAR WNR2000v5 router contains a buffer overflow which can be exploited to achieve remote code execution.","Apply updates per vendor instructions.","2022-04-15"
"CVE-2015-4068","Arcserve","Unified Data Protection (UDP)","Arcserve Unified Data Protection (UDP) Directory Traversal Vulnerability","2022-03-25","Directory traversal vulnerability in Arcserve UDP allows remote attackers to obtain sensitive information or cause a denial of service.","Apply updates per vendor instructions.","2022-04-15"
"CVE-2015-3035","TP-Link","Multiple Archer Devices","TP-Link Multiple Archer Devices Directory Traversal Vulnerability","2022-03-25","Directory traversal vulnerability in multiple TP-Link Archer devices allows remote attackers to read arbitrary files via a .. (dot dot) in the PATH_INFO to login/.","Apply updates per vendor instructions.","2022-04-15"
"CVE-2015-1187","D-Link and TRENDnet","Multiple Devices","D-Link and TRENDnet Multiple Devices Remote Code Execution Vulnerability","2022-03-25","The ping tool in multiple D-Link and TRENDnet devices allow remote attackers to perform remote code execution.","The impacted product is end-of-life and should be disconnected if still in use.","2022-04-15"
"CVE-2014-6287","Rejetto","HTTP File Server (HFS)","Rejetto HTTP File Server (HFS) Remote Code Execution Vulnerability","2022-03-25","The findMacroMarker function in parserLib.pas in Rejetto HTTP File Server (HFS or HttpFileServer) allows remote attackers to execute arbitrary programs.","Apply updates per vendor instructions.","2022-04-15"
"CVE-2013-5223","D-Link","DSL-2760U","D-Link DSL-2760U Gateway Cross-Site Scripting Vulnerability","2022-03-25","A cross-site scripting (XSS) vulnerability exists in the D-Link DSL-2760U gateway, allowing remote authenticated users to inject arbitrary web script or HTML.","Apply updates per vendor instructions.","2022-04-15"
"CVE-2019-7483","SonicWall","SMA100","SonicWall SMA100 Directory Traversal Vulnerability","2022-03-28","In SonicWall SMA100, an unauthenticated Directory Traversal vulnerability in the handleWAFRedirect CGI allows the user to test for the presence of a file on the server.","Apply updates per vendor instructions.","2022-04-18"
"CVE-2012-0518","Oracle","Fusion Middleware","Oracle Fusion Middleware Unspecified Vulnerability","2022-03-28","Unspecified vulnerability in the Oracle Application Server Single Sign-On component in Oracle Fusion Middleware allows remote attackers to affect integrity via unknown vectors","Apply updates per vendor instructions.","2022-04-18"
"CVE-2022-26871","Trend Micro","Apex Central ","Trend Micro Apex Central Arbitrary File Upload Vulnerability ","2022-03-31","An arbitrary file upload vulnerability in Trend Micro Apex Central could allow for remote code execution.","Apply updates per vendor instructions.","2022-04-21"
"CVE-2021-28799","QNAP","Network Attached Storage (NAS)","QNAP NAS Improper Authorization Vulnerability","2022-03-31","QNAP NAS running HBS 3 contains an improper authorization vulnerability which can allow remote attackers to log in to a device.","Apply updates per vendor instructions.","2022-04-21"
"CVE-2021-45382","D-Link","Multiple Routers","D-Link Multiple Routers Remote Code Execution Vulnerability","2022-04-04","A remote code execution vulnerability exists in all series H/W revisions routers via the DDNS function in ncc2 binary file.","The impacted product is end-of-life and should be disconnected if still in use.","2022-04-25"
"CVE-2022-23176","WatchGuard","Firebox and XTM","WatchGuard Firebox and XTM Privilege Escalation Vulnerability","2022-04-11","WatchGuard Firebox and XTM appliances allow a remote attacker with unprivileged credentials to access the system with a privileged management session via exposed management access.","Apply updates per vendor instructions.","2022-05-02"
"CVE-2021-39793","Google","Pixel","Google Pixel Out-of-Bounds Write Vulnerability","2022-04-11","Google Pixel contains a possible out-of-bounds write due to a logic error in the code that could lead to local escalation of privilege.","Apply updates per vendor instructions.","2022-05-02"
"CVE-2021-27852","Checkbox","Checkbox Survey","Checkbox Survey Deserialization of Untrusted Data Vulnerability","2022-04-11","Deserialization of Untrusted Data vulnerability in CheckboxWeb.dll of Checkbox Survey allows an unauthenticated remote attacker to execute arbitrary code.","Versions 6 and earlier for this product are end-of-life and must be removed from agency networks. Versions 7 and later are not considered vulnerable.","2022-05-02"
"CVE-2018-20753","Kaseya","Virtual System/Server Administrator (VSA)","Kaseya VSA Remote Code Execution Vulnerability","2022-04-13","Kaseya VSA RMM allows unprivileged remote attackers to execute PowerShell payloads on all managed devices.","Apply updates per vendor instructions.","2022-05-04"
"CVE-2019-16057","D-Link","DNS-320 Storage Device","D-Link DNS-320 Remote Code Execution Vulnerability","2022-04-15","The login_mgr.cgi script in D-Link DNS-320 is vulnerable to remote code execution.","The impacted product is end-of-life and should be disconnected if still in use.","2022-05-06"
"CVE-2018-7841","Schneider Electric","U.motion Builder","Schneider Electric U.motion Builder SQL Injection Vulnerability","2022-04-15","A SQL Injection vulnerability exists in U.motion Builder software which could cause unwanted code execution when an improper set of characters is entered.","The impacted product is end-of-life and should be disconnected if still in use.","2022-05-06"
"CVE-2010-5330","Ubiquiti","AirOS","Ubiquiti AirOS Command Injection Vulnerability","2022-04-15","Certain Ubiquiti devices contain a command injection vulnerability via a GET request to stainfo.cgi.","Apply updates per vendor instructions.","2022-05-06"
"CVE-2007-3010","Alcatel","OmniPCX Enterprise","Alcatel OmniPCX Enterprise Remote Code Execution Vulnerability","2022-04-15","masterCGI in the Unified Maintenance Tool in Alcatel OmniPCX Enterprise Communication Server allows remote attackers to execute arbitrary commands.","Apply updates per vendor instructions.","2022-05-06"
"CVE-2018-6882","Zimbra","Collaboration Suite (ZCS)","Zimbra Collaboration Suite (ZCS) Cross-Site Scripting (XSS) Vulnerability","2022-04-19","Zimbra Collaboration Suite (ZCS) contains a cross-site scripting vulnerability that might allow remote attackers to inject arbitrary web script or HTML.","Apply updates per vendor instructions.","2022-05-10"
"CVE-2019-3568","Meta Platforms","WhatsApp","WhatsApp VOIP Stack Buffer Overflow Vulnerability","2022-04-19","A buffer overflow vulnerability in WhatsApp VOIP stack allowed remote code execution via specially crafted series of RTCP packets sent to a target phone number.","Apply updates per vendor instructions.","2022-05-10"
"CVE-2022-29464","WSO2","Multiple Products","WSO2 Multiple Products Unrestrictive Upload of File Vulnerability","2022-04-25","Multiple WSO2 products allow for unrestricted file upload, resulting in remote code execution.","Apply updates per vendor instructions.","2022-05-16"
